{
  "$schema": "https://dsh-evolve-le.local/schemas/gate2.e2e.schema.json",
  "schemaVersion": 1,
  "runId": "gate2-dev",
  "recordedAt": "2026-10-06T04:53:11.776Z",
  "capsule": {
    "archiveSha256": "7ad2bb4555472bb489a3f1100186ca788a4f17f254e92d8cd7779c8712fb029c"
  },
  "artifactEndpoint": {
    "url": "https://172.17.0.1:8443",
    "caBundleContainer": "/opt/dsh-evolve-le/ca-bundle.crt"
  },
  "verifierModeProbe": {
    "verdict": "shared-only"
  },
  "harborVersion": "0.21.0\n",
  "flags": {
    "harborVersionOk": true,
    "capsuleBuilt": true,
    "artifactEndpointHttps": true,
    "jobCompleted": true,
    "trialAttributionOk": true,
    "verifierRan": true,
    "acpCandidateStreamed": true,
    "verifierModeProbed": true,
    "idempotencyLedgerSingleEntry": true,
    "idempotencyNoSecondTrial": true,
    "normalizationDeterministic": true
  },
  "notes": [
    "trial dirs before/after resume: 1/1"
  ]
}
